{
  "schemaVersion": 1,
  "stableId": "example-report-id",
  "kind": "category_only",
  "startedAt": "2026-08-08T10:00:00Z",
  "completedAt": "2026-08-08T10:01:00Z",
  "device": {
    "manufacturer": "Example",
    "model": "Phone",
    "brand": "Example",
    "product": "phone",
    "androidRelease": "16",
    "apiLevel": 36,
    "securityPatch": null
  },
  "app": {
    "versionName": "1.0.0",
    "versionCode": 1
  },
  "categories": [
    {
      "categoryId": "battery",
      "aggregateStatus": "info",
      "evidence": [
        {
          "categoryId": "battery",
          "checkId": "battery.level",
          "status": "info",
          "confidence": "high",
          "source": "android_api",
          "applicability": "applicable",
          "reason": null,
          "value": {
            "type": "int",
            "value": "80"
          },
          "unit": "percent",
          "capturedAt": "2026-08-08T10:00:30Z"
        }
      ]
    }
  ],
  "score": {
    "version": 2,
    "value": null,
    "state": "incomplete"
  },
  "coverage": {
    "applicableCount": 1,
    "completedCount": 1,
    "notTestedCount": 0,
    "unavailableCount": 0,
    "percentage": 100
  }
}
